{
  "artifacts": {
    "stderr": {
      "path": "artifacts/asset-provenance-tests.stderr.log",
      "sha256": "e9186c3f33723b2448b19c4d8c99423e719230067a8cdf19436eeb1ca283be88"
    },
    "stdout": {
      "path": "artifacts/asset-provenance-tests.stdout.log",
      "sha256": "e7709ec03ea0270e9934746c413a53a6df94e7c8b09e863cf2526607b40063fd"
    }
  },
  "classification": "COMMAND_RESULT",
  "command": {
    "argv": [
      "uv",
      "run",
      "pytest",
      "docs/evidence/stage-01/tests/test_asset_provenance_artifacts.py",
      "-q"
    ],
    "display": "uv run pytest docs/evidence/stage-01/tests/test_asset_provenance_artifacts.py -q"
  },
  "created_at_utc": "2026-07-18T13:37:41Z",
  "cwd": "/Volumes/Projects/ketos-stage01-integration",
  "ended_at_utc": "2026-07-18T13:37:41Z",
  "execution_revision": "d85449e3fa655899458c0b2dd5d5ec62f659c16e",
  "exit_code": 0,
  "notes": "Focused Graphify, telemetry, compatibility, Desktop, XYFlow and OpenSwarm artifact tests.",
  "owner": "stage01-asset-implementation",
  "profile": {
    "environment": {
      "platform": "macOS-26.5.1-arm64-arm-64bit-Mach-O",
      "python": "3.13.14"
    },
    "provided": {
      "suite": "asset-provenance-contracts"
    }
  },
  "record_id": "asset-provenance-tests",
  "reviewer": "pending",
  "source_baseline_sha": "80878261d07c21ad257de017d98069f211ada2c2",
  "started_at_utc": "2026-07-18T13:37:36Z",
  "task_id": "S01-T08-T13",
  "verdict": "PASS"
}
