{
  "artifacts": {
    "stderr": {
      "path": "artifacts/final-stage01-suite.stderr.log",
      "sha256": "e9186c3f33723b2448b19c4d8c99423e719230067a8cdf19436eeb1ca283be88"
    },
    "stdout": {
      "path": "artifacts/final-stage01-suite.stdout.log",
      "sha256": "99259f4b3d7224481ebcd3641e598dbd184b0c4492b54f52a55854eb3d29a1c8"
    }
  },
  "classification": "COMMAND_RESULT",
  "command": {
    "argv": [
      "uv",
      "run",
      "pytest",
      "docs/evidence/stage-01/tests",
      "-q"
    ],
    "display": "uv run pytest docs/evidence/stage-01/tests -q"
  },
  "created_at_utc": "2026-07-18T13:56:53Z",
  "cwd": "/Volumes/Projects/ketos-stage01-integration",
  "ended_at_utc": "2026-07-18T13:56:53Z",
  "execution_revision": "ab4c69da04ef36cb955566bbf68894441012ec61",
  "exit_code": 0,
  "notes": "Final full evidence suite at the immutable report and provenance payload commit.",
  "owner": "stage01-coordinator",
  "profile": {
    "environment": {
      "platform": "macOS-26.5.1-arm64-arm-64bit-Mach-O",
      "python": "3.13.14"
    },
    "provided": {
      "suite": "final-stage01-artifact-contracts",
      "transition": "NO-GO"
    }
  },
  "record_id": "final-stage01-suite",
  "reviewer": "evidence-review-pass-security-review-no-go",
  "source_baseline_sha": "80878261d07c21ad257de017d98069f211ada2c2",
  "started_at_utc": "2026-07-18T13:56:45Z",
  "task_id": "S01-T15",
  "verdict": "PASS"
}
