{
  "artifacts": {
    "stderr": {
      "path": "artifacts/runtime-route-inventory.stderr.log",
      "sha256": "e3b0c44298fc1c149afbf4c8996fb92427ae41e4649b934ca495991b7852b855"
    },
    "stdout": {
      "path": "artifacts/runtime-route-inventory.stdout.log",
      "sha256": "511f49dc2e7f28253dc91c4c01da7420685a92c34fd1364d8c50118d57c3117b"
    }
  },
  "classification": "COMMAND_RESULT",
  "command": {
    "argv": [
      "uv",
      "run",
      "python",
      "docs/evidence/stage-01/tools/route_inventory.py"
    ],
    "display": "uv run python docs/evidence/stage-01/tools/route_inventory.py"
  },
  "created_at_utc": "2026-07-18T13:33:29Z",
  "cwd": "/Volumes/Projects/ketos-stage01-integration",
  "ended_at_utc": "2026-07-18T13:33:29Z",
  "execution_revision": "c27d266a61bff8ace9d0ebc8eea820b5d2ac283c",
  "exit_code": 0,
  "notes": "Runtime registration dump; fields do not imply security PASS for inventory-only rows.",
  "owner": "stage01-security-implementation",
  "profile": {
    "environment": {
      "platform": "macOS-26.5.1-arm64-arm-64bit-Mach-O",
      "python": "3.13.14"
    },
    "provided": {
      "profile": "local-default-sanitized-no-lifespan",
      "secret_values": "[REDACTED]"
    }
  },
  "record_id": "runtime-route-inventory",
  "reviewer": "pending",
  "source_baseline_sha": "80878261d07c21ad257de017d98069f211ada2c2",
  "started_at_utc": "2026-07-18T13:33:22Z",
  "task_id": "S01-T06",
  "verdict": "PASS"
}
