{
  "artifacts": {
    "stderr": {
      "path": "artifacts/branch-sha.stderr.log",
      "sha256": "e3b0c44298fc1c149afbf4c8996fb92427ae41e4649b934ca495991b7852b855"
    },
    "stdout": {
      "path": "artifacts/branch-sha.stdout.log",
      "sha256": "20e8b626a2cd3a021a507002acc72bf2070d8a7b801e26f284d0f56e5331b600"
    }
  },
  "classification": "COMMAND_RESULT",
  "command": {
    "argv": [
      "git",
      "status",
      "--short",
      "--branch"
    ],
    "display": "git status --short --branch"
  },
  "created_at_utc": "2026-07-18T12:42:23Z",
  "cwd": "/Volumes/Projects/ketos-stage01-integration",
  "ended_at_utc": "2026-07-18T12:42:23Z",
  "execution_revision": "59d7110849da1dec02b929b90148c203e02a1ee7",
  "exit_code": 0,
  "notes": "Fresh integration branch status under evidence-contract v2.",
  "owner": "stage-01",
  "profile": {
    "environment": {
      "platform": "macOS-26.5.1-arm64-arm-64bit-Mach-O",
      "python": "3.13.14"
    },
    "provided": {}
  },
  "record_id": "branch-sha",
  "reviewer": "pending",
  "source_baseline_sha": "80878261d07c21ad257de017d98069f211ada2c2",
  "started_at_utc": "2026-07-18T12:42:23Z",
  "task_id": "S01-T01",
  "verdict": "PASS"
}
