{
  "artifacts": {
    "stderr": {
      "path": "artifacts/delivery-attestation.stderr.log",
      "sha256": "e3b0c44298fc1c149afbf4c8996fb92427ae41e4649b934ca495991b7852b855"
    },
    "stdout": {
      "path": "artifacts/delivery-attestation.stdout.log",
      "sha256": "510ace6773215cbc4766e3cb147b03ea2532c5cbb129d3dd07881875faecc65c"
    }
  },
  "classification": "COMMAND_RESULT",
  "command": {
    "argv": [
      "git",
      "rev-parse",
      "HEAD"
    ],
    "display": "git rev-parse HEAD"
  },
  "created_at_utc": "2026-07-18T12:45:26Z",
  "cwd": "/Volumes/Projects/ketos-stage01-integration",
  "ended_at_utc": "2026-07-18T12:45:26Z",
  "execution_revision": "9d8f62c9824c95c4bbb1a5bb21c7fde6a7c3657e",
  "exit_code": 0,
  "notes": "Post-payload delivery attestation. The following carrier commit stores this record; verify its parent equals this execution revision.",
  "owner": "stage-01",
  "profile": {
    "environment": {
      "platform": "macOS-26.5.1-arm64-arm-64bit-Mach-O",
      "python": "3.13.14"
    },
    "provided": {}
  },
  "record_id": "delivery-attestation",
  "reviewer": "pending",
  "source_baseline_sha": "80878261d07c21ad257de017d98069f211ada2c2",
  "started_at_utc": "2026-07-18T12:45:26Z",
  "task_id": "S01-T04",
  "verdict": "PASS"
}
