{
  "artifacts": {
    "stderr": {
      "path": "artifacts/root-dirty-status.stderr.log",
      "sha256": "e3b0c44298fc1c149afbf4c8996fb92427ae41e4649b934ca495991b7852b855"
    },
    "stdout": {
      "path": "artifacts/root-dirty-status.stdout.log",
      "sha256": "8b403bbf98a4f6936f8ee0bb74e2fd7666d4afb2a9cfa6fbd55fb8fa0f293b7c"
    }
  },
  "classification": "COMMAND_RESULT",
  "command": {
    "argv": [
      "git",
      "status",
      "--porcelain=v2"
    ],
    "display": "git status --porcelain=v2"
  },
  "created_at_utc": "2026-07-18T12:49:45Z",
  "cwd": "/Volumes/Projects/ketos_canvas_mod_main",
  "ended_at_utc": "2026-07-18T12:49:45Z",
  "execution_revision": "4df0e1dc55382734e51d7921c43c9aeb32bca999",
  "exit_code": 0,
  "notes": "User-owned root checkout status; observe only.",
  "owner": "stage-01",
  "profile": {
    "environment": {
      "platform": "macOS-26.5.1-arm64-arm-64bit-Mach-O",
      "python": "3.13.14"
    },
    "provided": {}
  },
  "record_id": "root-dirty-status",
  "reviewer": "pending",
  "source_baseline_sha": "80878261d07c21ad257de017d98069f211ada2c2",
  "started_at_utc": "2026-07-18T12:49:45Z",
  "task_id": "S01-T01",
  "verdict": "PASS"
}
