{
  "artifacts": {
    "stderr": {
      "path": "artifacts/final-scope-diff-check.stderr.log",
      "sha256": "e3b0c44298fc1c149afbf4c8996fb92427ae41e4649b934ca495991b7852b855"
    },
    "stdout": {
      "path": "artifacts/final-scope-diff-check.stdout.log",
      "sha256": "098760dbcba62e8aa91ca393c89d5e8679b30176bfded4d885218648fdbaf007"
    }
  },
  "classification": "COMMAND_RESULT",
  "command": {
    "argv": [
      "git",
      "diff",
      "--check",
      "80878261d07c21ad257de017d98069f211ada2c2..HEAD"
    ],
    "display": "git diff --check 80878261d07c21ad257de017d98069f211ada2c2..HEAD"
  },
  "created_at_utc": "2026-07-18T13:54:10Z",
  "cwd": "/Volumes/Projects/ketos-stage01-integration",
  "ended_at_utc": "2026-07-18T13:54:10Z",
  "execution_revision": "02d9501d7087a331442b5e3cd826f0b17caed0cc",
  "exit_code": 2,
  "notes": "Final payload whitespace and patch-shape gate.",
  "owner": "stage01-coordinator",
  "profile": {
    "environment": {
      "platform": "macOS-26.5.1-arm64-arm-64bit-Mach-O",
      "python": "3.13.14"
    },
    "provided": {
      "allowed_scope": "docs/evidence/stage-01/**",
      "gate": "git-diff-check"
    }
  },
  "record_id": "final-scope-diff-check",
  "reviewer": "pending-final-compliance",
  "source_baseline_sha": "80878261d07c21ad257de017d98069f211ada2c2",
  "started_at_utc": "2026-07-18T13:54:09Z",
  "task_id": "S01-T15",
  "verdict": "FAIL"
}
