{
  "artifacts": {
    "stderr": {
      "path": "artifacts/security-inventory-tests.stderr.log",
      "sha256": "e9186c3f33723b2448b19c4d8c99423e719230067a8cdf19436eeb1ca283be88"
    },
    "stdout": {
      "path": "artifacts/security-inventory-tests.stdout.log",
      "sha256": "1bf6d8c3177ae64bb5a1023e7d979dc8c2929788bbccad79b336b62e3853190c"
    }
  },
  "classification": "COMMAND_RESULT",
  "command": {
    "argv": [
      "uv",
      "run",
      "pytest",
      "docs/evidence/stage-01/tests/test_security_inventory_artifacts.py",
      "-q"
    ],
    "display": "uv run pytest docs/evidence/stage-01/tests/test_security_inventory_artifacts.py -q"
  },
  "created_at_utc": "2026-07-18T13:31:22Z",
  "cwd": "/Volumes/Projects/ketos-stage01-integration",
  "ended_at_utc": "2026-07-18T13:31:22Z",
  "execution_revision": "8d11215adb8d64a7d8d56ec83ef63445eede06be",
  "exit_code": 0,
  "notes": "Focused artifact contract tests.",
  "owner": "stage01-security-implementation",
  "profile": {
    "environment": {
      "platform": "macOS-26.5.1-arm64-arm-64bit-Mach-O",
      "python": "3.13.14"
    },
    "provided": {
      "suite": "focused-evidence-artifacts"
    }
  },
  "record_id": "security-inventory-tests",
  "reviewer": "pending",
  "source_baseline_sha": "80878261d07c21ad257de017d98069f211ada2c2",
  "started_at_utc": "2026-07-18T13:31:18Z",
  "task_id": "S01-T05-T07",
  "verdict": "PASS"
}
